"","sysrev_id","analysis_id","adriencomte.pro","deviveytia","title","abstract"
"310",95440586,10939,FALSE,TRUE,"Governance fit for climate change in a Caribbean coastal-marine context","Coastal-marine systems in small island developing states of the Caribbean are highly vulnerable to both current and future climate change. Societies navigate these changes in part through processes of governance and the institutions through which governance takes place. The concept of institutional adaptive capacity is used to explore how governance processes and institutional arrangements can be adapted to match the scale and extent of climate change in a case study of the Soufriere Marine Management Area, St. Lucia. Institutional adaptive capacity is analyzed based on the following factors: institutional variety, analytical deliberation and nesting and networks. The analysis is based on 36 semi-structured interviews conducted with key informants from NGOs, cooperatives, management authorities and government agencies. The findings suggest that governance to address climate change in the case study is contingent upon developing holistic, integrated management systems, improving flexibility in existing collaborative decision making processes, augmenting the capacity of local management authorities with support from higher-level government, exploring opportunities for private-social partnerships, and developing adequate social-environmental monitoring programs. These findings have potential implications and lessons for similar settings throughout the Caribbean. (C) 2014 Elsevier Ltd. All rights reserved."
"314",95440590,240436,FALSE,TRUE,"Managing extreme natural disasters in coastal areas","Extreme natural hazards, particularly the hydro-meteorological disasters, are emerging as a cause of major concern in the coastal regions of India and a few other developing countries. These have become more frequent in the recent past, and are taking a heavy toll of life and livelihoods. Low level of technology development in the rural areas together-with social, economic and gender inequities enhance the vulnerability of the largely illiterate, unskilled, and resource-poor fishing, farming and landless labour communities. Their resilience to bounce back to pre-disaster level of normality is highly limited. For the planet Earth at crossroads, the imminent threat, however, is from a vicious spiral among environmental degradation, poverty and climate change-related natural disasters interacting in a mutually reinforcing manner. These, in turn, retard sustainable development, and also wipe out any small gains made thereof. To counter this unacceptable trend, the M.S. Swaminathan Research Foundation has developed a biovillage paradigm and rural knowledge centres for ecotechnological and knowledge empowerment of the coastal communities at risk. Frontier science and technologies blended with traditional knowledge and ecological prudence result in ecotechnologies with pro-nature, pro-poor and pro-women orientation. The rural communities are given training and helped to develop capacity to adopt ecotechnologies for market-driven eco-enterprises. The modern information and communication-based rural knowledge centres largely operated by trained semi-literate young women provide time- and locale-specific information on weather, crop and animal husbandry, market trends and prices for local communities, healthcare, transport, education, etc. to the local communities. The ecotechnologies and time- and locale-specific information content development are need-based and chosen in a `bottom-up' manner. The use of recombinant DNA technology for genetic shielding of agricultural crops for coastal regions against abiotic stress (induced by the water- and weather-related natural disasters), strengthens the foundations of sustainable agriculture undertaken by the resource poor small farm families."
"336",95440612,111548,TRUE,FALSE,"Adaptive business arrangements and the creation of social capital: Towards small-scale fisheries resilience in different European geographical areas","European small-scale fisheries are confronted with several challenges, notably a decrease in the number of people engaged in capture fishing, growing competition from less expensive extra-European Union markets, rising operational costs, strict regulations and the depletion of fishing stocks. Many small-scale fishers must adapt to change to maintain or increase their income using different business strategies. In this respect, we argue that new and diversified institutional arrangements combined with building social capital can help reach long-term economic sustainability for small-scale fisheries businesses, as well as the social-ecological resilience of coastal areas. In order to understand and analyse the multiplicity of strategies applied by small-scale fishers-including expansion towards non-productivist activities, this article examines the role of new institutional arrangements based on small-scale, traditional, quality-orientated, multifunctional business strategies and non-fishing activities. Using a case-study approach, we analyse-in three different European fishery contexts (Greece, Italy and the UK)-how the interplay between building adaptive arrangements and the creation of social capital in selected small-scale fisheries provides relevant prerequisites for resilience."
"346",95440622,12156,TRUE,FALSE,"Wave of change: Coping with catastrophe","We described and analyzed the capacity of a community to adapt to the impacts of a tsunami on their livelihoods. We looked at the community's responses to the impacts of the tsunami and the factors that influenced its adaptive capacity. Based on this analysis, we present a number of lessons learned that are meant to enhance the adaptive capacity and resilience of communities to the impacts of sudden disasters, such as a tsunami, or a slow-building catastrophe, such as global warming. The study community consisted of two village groups in an island community named Koh Yao Noi in southern Thailand that sustained losses to its resources and means of livelihood from the Indian Ocean tsunami of 26 December 2004. The Intergovernmental Organization of the Network of Aquaculture Centres in Asia-Pacific selected the community as a study site in order to gain a border understanding of the effects of external assistance provided for livelihoods recovery and long-term development. The various actions by the community demonstrate a longer-term view of rehabilitation than the immediate benefits available from aid. During the rehabilitation period, the community exhibited self-reliance, broad participation in decision making, trustworthiness, the ability to find opportunities opened up by the assistance without being opportunistic, and concern for the worse-off among their ranks. Collective action characterized the way the community utilized and took advantage of the opportunities presented by external assistance. An analysis of the factors that contributed to the community's resilience and adaptive capacities indicates the importance of social capital or assets. This finding was the basis for the three lessons drawn from the study: (1) a strong social asset enabled the community to effectively mitigate the impacts of the disaster on their other livelihood assets, (2) resiliency and better adaptive capacity can be enhanced by the creation of diverse social networks, and (3) resiliency can be increased by developing redundancy to manage risk. These lessons suggested a number of practical measures, namely fostering organized groups, mutual assistance or self-help clusters, and formal associations; facilitating the establishment of functional linkages, working relations, and communication links between organized community groups and appropriate external bodies but in a way in which the relations are a partnership rather than a donor-recipient relationship; and enhancing, with training and other measures, group decision-making skills in planning and solving community problems to make the community a stronger partner to the local government as well as to avoid being overly dependent on government for decisions on community matters. The broader policy implications of the study include a set of recommendations for developing postdisaster adaption measures based on local livelihoods and livelihood assets and for integrating community-level adaptation activities into national policy processes."
"347",95440623,225539,TRUE,FALSE,"Singapore's Lost Coast: Land Reclamation, National Development and the Erasure of Human and Ecological Communities, 1822-Present","Beginning during the colonial period, and greatly accelerating following independence in 1965, Singapore has used land reclamation to increase its national domain by nearly 25 per cent. The construction of new land was a key component of the nation's celebrated rise from `third world' to `first world' in the postcolonial period. But the economic benefits of remaking Singapore's coastline came at significant ecological and social costs. Nearly all of the original shore, and its attendant mangrove forests and natural beaches, were lost. So too were two-thirds of Singapore's coral reefs. While carrying out this reclamation, the state also erased a number of sites at which people made a living from the sea, including indigenous communities on the outer islands, age-old fishing villages, kelongs (large, traditional offshore fishing platforms) and prawn farms. The history of land construction in Singapore offers a number of important insights concerning the relationship between humans and our environments. First, it reveals how the tensions between an ideal situation (a city or state's relationship to other places) and a less than optimum site (its physical environment), when combined with a forceful, proactive government, can bring about immense environmental transformations. Related to that, this case sheds light on the ways in which governments - especially in developing nations can use transformation of terrestrial and marine environments, in the name of progress, as a means of expanding and legitimating their authority. This history also reveals a perhaps unforeseen consequence of bulldozing and burying sites at which humans derived their livelihood from living oceanic resources: the loss of a cultural connection to the sea, based on knowing nature through work. Finally, this history raises the question of how environmental advocates can pursue conservation in a setting like Singapore's shores, which we can no longer consider pristine or natural. That is to say, the ongoing efforts of environmentalists to protect flora and fauna in Singapore's waters speak to the necessity of, and challenges presented by, preserving hybrid (neither entirely natural nor entirely artificial) marine environments."
"354",95440630,285541,FALSE,TRUE,"Causes, Effects, and Remedial Measures of Climate Change in the East Coast of India with Special Reference to the State of Odisha","Climate change has put tremendous impact on the environment in the current scenario. The consequences are extensive consequences on the atmosphere, agronomy, water resources, biome, natural reserves, budget, biodiversity, and social security. Odisha, lying in the Eastern Coast of India connecting the Bay of Bengal, has a stretch of 480 km of coastline and is always vulnerable to climate change in terms of heavy storm like cyclones, beach erosion, coastal flooding, storm swell, and denudation. This state has scores of agro-climatic sectors which require improvement in the shape of diverse reworking approaches keeping pace with the ongoing scenario of climate change. Adaptation strategies such as agriculture, fisheries and animal husbandry, water, health, and coastal and disaster risk management have been formulated looking at the vulnerability, food security, and other parameters. Major steps have been initiated to mitigate the impact of climate change; still a lot of further strategies need to be dealt with to keep the region safe and disaster free. These include energy, urban development, transport, industries, and waste disposal. Proper attention must be adhered to embracing judicious policies on energy efficiency based on enactment, modifying state building codes and development codes to improve LULC, transportation, and energy productivities, establishment of new renewable energy policies, assortment and related criterions and reinforce multi-segment parameters to cater to the upcoming challenges related to reduction in poverty and increasing the adaptive capacity. Several initiatives have been undertaken in the government, private, and NGO sectors, but still lack of proper vision, appropriate mission, and slow pace of implementation has jeopardized the entire development. © 2022, The Author(s), under exclusive license to Springer Nature Switzerland AG."
"367",95440643,265929,TRUE,FALSE,"Ridge to reef to peace and development","Mindanao is known as the food basket of the Philippines with its abundant agri-fishery production. Fertile soil and excellent climate make it as the agri-fishery export zone of the country. Yet, climate change has brought a drastic shift on Mindanao’s popularity making it exposed to risks associated to natural disaster, such as typhoons, flooding, mudslides and earthquakes. The occurrence of super typhoons in 2011 and 2012 had caused significant damages to agriculture, infrastructure and dwellers. This new normal prompted the Mindanao Development Authority (MinDA) to revolutionise the ridge-to-reef approach through the Mindanao Nurturing Our Waters Program as a holistic and integrated approach to the preservation, utilisation, restoration, rehabilitation and development of natural resources. This study was an attempt to answer the questions: (1) would the ridge-to-reef approach be appropriate for Mindanao with the emergence of a new normal? And (2) what mechanism can aptly implement the approach? This study employed qualitative research using scoping, metasynthesis, focus group discussions and expert panel discussions. Results revealed various environmental issues that impact on economy, land use, energy, agriculture, marine life, health and budget. Many agencies are involved in environment and natural resource management, resulting to overlaps and conflicts. In addressing the challenges, it was revealed that MinDA is effective and credible as a mechanism in steering and providing strategic directions and partnerships among actors. Thus, the out-of-the-box wave of ridge-to-reef approach through the Mindanao Nurturing Our Waters Program is appropriate in Mindanao context under an inclusive and transformative leadership of a subnational agency. © Springer India 2015."
"369",95440645,11424,TRUE,FALSE,"Reducing vulnerability to climate change in the Arctic: The case of Nunavut, Canada","Research conducted with the communities of Arctic Bay and Igloolik in Nunavut identified key areas where policy can help Inuit reduce their vulnerability to climate change, focusing on the renewable resource harvesting sector. The policy responses are based on an understanding of policy development and decision making and on an understanding of the processes that shape vulnerability, which in Nunavut comprise the erosion of traditional Inuit knowledge and land-based skills, the weakening of social networks, and a reduction in harvesting flexibility. Policies relating to cultural preservation, wildlife co-management, and harvester support can serve as entry points for influencing these processes. Our recommendations fall within the mandates of the Government of Nunavut and the institutions created under the Nunavut Land Claims Agreement, and they have been identified as policy priorities by communities and Inuit organizations."
"375",95440651,6563,FALSE,TRUE,"Factor influencing fishery-based farmers' perception and their response to climate-induced crisis management.","Time and again, climate change is a global phenomenon; intrinsically affects people and the environment more at the local and the global level when driven anthropogenically. Due to multiple reasons, the coastal region is more vulnerable to ongoing and forthcoming climate change. The study was conducted to develop a framework and to discuss the perception of fishery-based farmers and their response to the climate-induced crisis through their management practices. It is well known that preventing climate change is costly; alternatively, measures can be initiated to mitigate its adverse effects on humans as well as on the ecosystem. The importance of utilizing the internal physical, social, and psychological aspects of a farming community to deal with crisis management efficiently has been unearthed in this study. It is understood that climate-induced crisis management is contributed by psycho-socio-economic factors associated with the farmer and his environment. The computing effects of these exogenous variables may lead to the emergence of hybrid, moribund, socio-economic structures, which may increase the tendency of farmers for vulnerability to climate change. Analysis of these variables affecting crisis management will help to identify and undertake practical approaches to alter the favourable and manipulable variables connected with crisis management. The results are more relevant for farmers, extension professionals, governmental agencies, Non-Government Organizations, and scientists who play a definite role in the management of crisis-induced by climate change."
"376",95440652,156173,TRUE,FALSE,"Evaluating alternative policies for managing an Alaska pollock fishery with climate change","A previous study finds that the average percentage reduction in pollock catch from rising sea surface temperatures (SSTs), which is calculated based on simulated climate scenarios, is about 29\% over a 42-year period (2009-2050). In the present study, we evaluate the seven alternative strategies in the previous study from an economic perspective. To do so, we couple alternative harvest policy simulations using a dynamic computable general equilibrium model for Alaska to assess the regional economic effects of rising SST and to compare the impacts from the alternative policies in terms of regional output, economic welfare, and real gross regional product. We find that the status quo policy performs less well than the alternatives. The policy allowing harvests to be less constrained performs worse. Overall, more conservative policies perform the best from an economic impact perspective. This result is contrasted with the finding in the previous study that the policy that makes downward adjustment to the fishing mortality as the stock size nears the target size performs best from a biological perspective."
"379",95440655,9637,TRUE,FALSE,"Innovative Aquaculture for the Poor to Adjust to Environmental Change in Coastal Bangladesh? Barriers and Options for Progress","More so than wealthier, less nature-dependent social groups, the poor in tropical coastal regions suffer from adverse environmental change and need new income options. With high levels of saltwater intrusion into coastal lands, innovative brackish water aquaculture (BWA) including integrated multi-trophic aquaculture (IMTA) are crucial adaptation options to the expanding marine waters. This article examines how poor Bangladeshi coastal residents view BWA, and what is needed to make BWA a viable and sustainable livelihood for the coastal poor. In sites that are affected by major salinity intrusion, we used a semi-structured questionnaire to interview 120 households. We examine three questions: (1) What kind of aquaculture is currently being undertaken in brackish/saline/coastal waters? (2) Do poor coastal residents see BWA (and, by implication the hitherto fairly unknown IMTA) as a viable and sustainable livelihood? (3) What is needed to make BWA a feasible and promising livelihood in Bangladesh? Our results show both information and perception biases obstruct in particular coastal poor women and men from engaging with innovative BWA. Their knowledge on ecosystem-based aquaculture was scarce and their views of aquaculture were related mainly to previous experiences with shrimp monoculture and its polarizing socio-economic effects. We propose some strategic fields of action to develop innovative BWA that also benefits coastal Bangladesh's poorest people."
"383",95440658,242405,TRUE,FALSE,"The role of women in community resilience to climate change: A case study of an Indigenous Fijian community","Climate change is projected to have wide-ranging effects on natural resources, environment, agriculture and fisheries. The various impacts of climate change pose significant risks to Pacific Island communities and people's livelihoods. A community consists of different groups of people and requires contributions from all members to build community resilience to the impacts of climate change. The Indigenous Fijian (iTaukei) women have skills, knowledge, and unique local and traditional experience that can increase the resilience of the community, however, their voice is not often heard in a patriarchal community. An understanding of gender roles in a community is essential for adaptation to climate change. Fijian communities exhibit elaborate social support system and traditional practices that demonstrate high level of dynamism and institutional support in the community's response to risks. Using semi-structured interviews, focus groups, and participant observations, the study investigated the enabling and inhibiting factors that affect the ability of iTaukei women to contribute to building community resilience. The findings from the study identified that the village women contribute significantly to three key areas of community resilience, particularly social resilience, economic resilience and ecological resilience. The findings also indicated that women face barriers that prevent them from contributing to decision-making on issues related to climate change resilience in the community. The study recommends interventions that are culturally accepted and that also support the role of women in decision-making, while promoting their participation in various climate change forums in the community."
"398",95440673,246362,TRUE,FALSE,"Communicating marine climate change impacts in the Caribbean and Pacific regions","The scientific literature on marine and coastal climate change has proliferated in recent decades. Translating and communicating this evidence in a timely, and accessible manner, is critical to support adaptation, but little is being done to summarise the latest science for decision makers. For Small Island Developing States (SIDS), which are highly vulnerable to marine and coastal climate change impacts, there is an urgent need to make the latest science readily available to inform national policy, leverage climate funding and highlight their vulnerability for international reports and climate negotiations. Climate change report cards are a proven successful way of presenting climate change information in an easily accessible and informative manner. Here we compare the development of marine climate change report cards for Caribbean and Pacific Commonwealth SIDS as a means of translating the latest science for decision makers. Regional engagement, priority issues and lessons learnt in these regions are compared, and future opportunities identified."
