"","sysrev_id","analysis_id","adriencomte.pro","deviveytia","title","abstract"
"177",95440451,2081,TRUE,FALSE,"To Fish or Not to Fish: Factors at Multiple Scales Affecting Artisanal Fishers' Readiness to Exit a Declining Fishery","Globally, fisheries are challenged by the combined impacts of overfishing, degradation of ecosystems and impacts of climate change, while fisheries livelihoods are further pressured by conservation policy imperatives. Fishers' adaptive responses to these pressures, such as exiting from a fishery to pursue alternative livelihoods, determine their own vulnerability, as well as the potential for reducing fishing effort and sustaining fisheries. The willingness and ability to make particular adaptations in response to change, such as exiting from a declining fishery, is influenced by economic, cultural and institutional factors operating at scales from individual fishers to national economies. Previous studies of exit from fisheries at single or few sites, offer limited insight into the relative importance of individual and larger-scale social and economic factors. We asked 599 fishers how they would respond to hypothetical scenarios of catch declines in 28 sites in five western Indian Ocean countries. We investigated how socioeconomic variables at the individual-, household- and site-scale affected whether they would exit fisheries. Site-level factors had the greatest influence on readiness to exit, but these relationships were contrary to common predictions. Specifically, higher levels of infrastructure development and economic vitality - expected to promote exit from fisheries - were associated with less readiness to exit. This may be due to site level histories of exit from fisheries, greater specialisation of fishing households, or higher rewards from fishing in more economically developed sites due to technology, market access, catch value and government subsidies. At the individual and household scale, fishers from households with more livelihood activities, and fishers with lower catch value were more willing to exit. These results demonstrate empirically how adaptive responses to change are influenced by factors at multiple scales, and highlight the importance of understanding natural resource-based livelihoods in the context of the wider economy and society."
"184",95440458,248528,TRUE,FALSE,"Ocean futures: Exploring stakeholders' perceptions of adaptive capacity to changing marine environments in Northern Norway","Globally, the projected increase in sea surface temperature is expected to facilitate large changes in the marine food web, affect coastal communities, marine ecosystem goods and services, global fisheries, tourism, aqua culture and others. This ongoing change takes place on different time scales, and coincides with increasing global demand for seafood, a growing middle class, and expectations of future need for food security from the marine sector. This article contributes to advances in climate change research by exploring, within the context of the results of the viewExposed program for assessing Integrated Vulnerabilities in different municipalities in Norway, to what extent stakeholders in different industries are willing to accept, or expect to be able to adapt to, these new realities. This was investigated through stakeholder driven workshops with stakeholders from maritime industries, commercial fisheries, tourism and aquaculture in Norway using the conceptual modeling tools of systems thinking and Bayesian Belief Networks. Results showed that commercial fishers are worried about quota allocations with changes in fish distribution. The aquaculture industry was worried about allocations of new areas for industry expansion in contested areas in Northern Norway, and the tourism industry was worried about changes in communications (transport) in light of a changing climate. Only the commercial fishers perceived that their adaptive capacity was low in light of these changes, especially the small-scale coastal fishers. This was because they expected the combination between increased power of the aquaculture industry and new species requiring expensive quotas would be too critical."
"185",95440459,824,TRUE,FALSE,"Coastal to inland: Expansion of prawn farming for adaptation to climate change in Bangladesh","The practice of prawn (Macrobrachium rosenbergii) farming is widespread in coastal Bangladesh due to favorable biophysical resources. However, export-oriented prawn farming is particularly vulnerable to climate change in coastal Bangladesh. This study identified different climatic variables, including salinity, coastal flooding, cyclone, sea-level rise, water temperature, drought, and rainfall have profound effects on prawn farming in the Bagerhat area of southwest Bangladesh. Considering extreme vulnerability to the effects of climate change on prawn production, one of the adaptation strategies is to translocate prawn culture from coastal to inland (i.e., Bagerhat-Gopalganj) that appear less vulnerable to climate change. Although the prospects for prawn-carp polyculture and integrated prawn-fish-rice farming are positive in Gopalganj, a number of challenges were identified for the expansion of prawn culture. We suggest that institutional support would help to adopt prawn production. (C) 2015 The Authors. Published by Elsevier B.V."
"186",95440460,1374,TRUE,FALSE,"Incremental and transformative adaptation preferences of rice farmers against increasing soil salinity-Evidence from choice experiments in north central Vietnam","Context: Increasing salinity levels demand adaptative and transformative changes in farming systems in regions affected by saltwater intrusion intensified by global climate change. The study area, a narrow delta affected by salinity intrusion due to rising sea levels as well as by diminishing rainfall during the dry season in north-central coastal region of Vietnam represents this global challenge. Apart from the level of salinity, farmer characteristics, legal framework and the expected returns to investment on the available choices shape the future trajectories of these farming systems. Nevertheless, relatively less research efforts are focused on understanding these choices and the trade-offs. Objective: The study focus on identifying and determining the acceptability of adopting stress tolerant rice varieties, changes in cropping sequences, or a transformative shift to aquaculture conditional to the degree of saltwater intrusion as well as gaining insight into required policy changes to facilitate the adaptation and transformation in rice farming deltas. Methods: The current study reports a novel choice experiment (CE) approach to analyse the roles of risk attitude, expected returns, production costs, effort levels and legal restrictions on the preferences for adaptation alternatives and their interactions with salinity levels using random parameter models. Results and conclusions: The results reveal the role of perceived risks and labour efforts in adaptative choices and highlight the need for risk offset mechanisms as well as labour-saving interventions. The simulations using the estimated random parameter models predict farmers affected by salinity below the critical threshold of 4 dS/m of electrical conductivity (EC) will have a 34.4\% adoption rate for traditional rice and a 43.6\% rate for salinitytolerant rice varieties, which will drop by 2 to 3 percentage points when the current legal restrictions on conversion to aquaculture are waived. In the case of farmers facing higher salinity levels, aquaculture would likely become the dominant option, with 40\% of the cohort of farmers adopting aquaculture (17.2\% adopting shrimp and 22.4\% adopting polyculture), followed by saline-tolerant rice (36\% to 38\%). Significance: The results reveal the need for increased investment in rice breeding for salinity tolerance, market development for alternative crops, introduction of risk offset mechanisms and a planned shift to transformative alternatives such as aquaculture. The findings of this study call for a balanced effort for adaptative and transformative options for rice farmers, infrastructural options preventing salinity intrusion and enhanced global mitigation efforts to reduce the possible rise in sea levels and limit salinity intrusion."
"187",95440461,316,TRUE,FALSE,"Community- based climate change adaptation strategies for integrated prawn- fish- rice farming in Bangladesh to promote social- ecological resilience","Farming freshwater prawns with fish in rice fields is widespread in the coastal region of southwest Bangladesh because of favourable resources and ecological conditions. This article provides an overview of an ecosystem-based approach to integrated prawn-fish-rice farming in southwest Bangladesh. The practice of prawn and fish farming in rice fields is a form of integrated aquaculture-agriculture, which provides a wide range of social, economic and environmental benefits. Integrated prawn-fish-rice farming plays an important role in the economy of Bangladesh, earning foreign exchange and increasing food production. However, this unique farming system in coastal Bangladesh is particularly vulnerable to climate change. We suggest that community-based adaptation strategies must be developed to cope with the challenges. We propose that integrated prawn-fish-rice farming could be relocated from the coastal region to less vulnerable inland areas, but caution that this will require appropriate adaptation strategies and an enabling institutional environment."
"195",95440470,233167,TRUE,FALSE,"The Impacts of Fishermen's Resilience towards Climate Change on Their Well-Being","This study aims to examine the mediating effect of climate resilience on the relationship between socio-economic, social relationship, social environment, and sense of community with fishermen's subjective well-being (life satisfaction, positive feeling, and negative feeling). This quantitative study performed a multi-stage sampling and selected 400 fishermen as respondents. For analysis purpose, this study relied on Partial Least Square Structural Equation Modelling (PLS-SEM). The structural model concluded that socio-economic, social relationship, social environment, and sense of community explained 55.4\% variance in resilience. The mediating analysis confirmed the resiliency mediating effect on all twelve hypothesized relationships. A number of recommendations related to extending the areas of the study, to focus specifically on the small-scale fishermen, and to consider the inclusion of several others' additional mediating effects were highlighted."
"206",95440481,172664,TRUE,FALSE,"Resource perception, livelihood choices and fishery exit in a Coastal Resource Management area","Effective measures to reduce fishing pressure require understanding of livelihood strategies and fishers' decisions to exit or stay in a fishery. Face-to-face semi-structured interviews were conducted with 85 municipal and small-scale commercial fishers within the Bayawan Coastal Resource Management (CRM) area in the Philippines. Fishers rated management measures, perceived changes in overall catch and finfish abundance, and were asked their expectations regarding future changes in finfish abundance. They also estimated their likelihood of exiting the fishery under theoretical catch reduction scenarios. Less than half of fishers would exit the fishery if catch halved. Binary logistic regression showed that negative perceptions of future finfish abundance significantly explained increased likelihood of exiting the fishery (z = -2.606, df 1, p < 0.05) and that increased livelihood diversity weakly supported staying in the fishery (z = 1.818, df 1, p = 0.069). Although stock management measures enjoy strong support in the studied area, fishers are most likely to exit fisheries when they consider stocks to be in continuing decline rather than sustainably managed. Increasing livelihood diversity reduced fishery exit likelihood as alternative livelihoods supplement and complement otherwise non-viable fishing. Results indicate incorrectly targeted livelihood diversification measures aimed at reducing fishing effort may achieve the opposite of their intended effect. If alternative livelihood options are to be viable and effective in reducing fishing pressure these must be attractive to fishers identified as willing to exit the fishery, and by their nature or conditions pre-require foregoing of fishing activities. (C) 2012 Elsevier Ltd. All rights reserved."
"208",95440483,12729,FALSE,TRUE,"Perceived impacts of climate change, coastal development and policy on oyster harvesting in the Southeastern United States","Oyster harvest has long been an important industry of the eastern coast of the United States. However, coastal development, overfishing and climate change are threatening this industry and way of life. This study examines the perspectives of oyster harvesters and merchants in Brunswick County, North Carolina, USA to explore their capacity to adapt to these changing conditions. Using in-person, semi-structured interviews researchers collected information from seventeen interviewees, generating qualitative data that were analyzed using MAXQDA software. From the data collected several themes emerged revealing mixed sentiments on the impacts of climate change but a widespread sense that development and regulations threaten livelihoods and cultural heritage. This social-ecological system (SES), created through centuries of regulation, is experiencing rapid population growth with concurrent coastal development; it also includes oyster industry workers who have limited voice in decision-making but are affected by the political ecology of the region. Deliberately including oyster harvesters and merchants when formulating and implementing policy can help to strengthen the adaptive capacity of this SES while sustaining Brunswick County's coastal heritage. (C) 2014 Elsevier Ltd. All rights reserved."
"210",95440485,6374,TRUE,FALSE,"Vulnerability of the coastal zone of The Gambia to sea level rise and development of response strategies and adaptation options","The coastal zone of The Gambia consists of 70 km open ocean coast and 200 km sheltered coast. Only about 20 km of the open coastline is significantly developed and this includes Banjul (the capital city), Bakau and Cape St. Mary, Fajara and the Tourism Development Area (TDA). Tourism is the most important economic sector in the coastal zone and contributes about 10\% of the government revenue. Fisheries and agriculture are also important coastal industries. In this study the Aerial Videotape-assisted Vulnerability Analysis (AVVA) technique has been used to provide a detailed analysis of vulnerability to sea level rise, and adaptation strategies have been identified. The data used includes a video recording of the coastline, color infrared and black and white aerial photography, topographic maps, bathymetric maps, a geological map of The Gambia and still photographs. The data have been used to characterize the coastal zone into 9 geomorphological units, wherein the cultural and heritage sites of economic importance have been delineated and characterized according to their biophysical and economic importance. Future erosion rates have been projected by applying the Bruun Rule, and future total land loss due to inundation in response to global warming and accelerated sea level rise has been determined. The sea level rise scenarios considered are 0.2 m, 0.5 m, and 1.0 m per century. Inundation is estimated to be about 92.32 x 10(6) m(2) for a 1.0 m sea level rise, 45.89 x 10(6) m(2) for a 0.5 m sea level rise and 4.96 x 10(6) m(2) for a 0.2 m sea level rise. The greater part of this area lost will be wetlands and mangrove systems important for fish spawning areas and habitats for wildlife. Shoreline retreat is estimated to vary between about 6.8 m in cliffy areas to about 880 m for more flat and sandy areas based on the Bruun Rule. Population and physical structures at risk have been determined. Attempts have been made to report this loss in monetary terms, but firm figures are not yet available. Only one unit of the coastal zone has been evaluated. In this unit, it is expected that the capital city will be completely lost through both erosion and inundation within 50 to 60 yr with a total of 42000 persons displaced. Lands and physical structures to be lost are estimated at US\$ 217 million. Response strategies and adaptation options identified include: innovative sand management, building and rehabilitation of groins, construction of revetments to protect important areas, construction of sea-walls/bulkheads, public outreach and awareness, building regulations and urban growth planning, wetland preservation and mitigation, and development of a coastal zone management plan."
"224",95440500,234167,TRUE,FALSE,"Activating Adaptive Capacities: Fishing Communities in Northern Norway","We have increasingly more knowledge about the factors and processes that determine or shape adaptive capacity, but few studies that specifically address whether such capacity in fact is activated and used. In this chapter we draw on findings from a number of related empirical studies undertaken in northern Norwegian coastal communities between 2007 and 2014 to investigate whether the narrative, `vi star han av' - ``we face whatever comes{''}, as a subjective dimension of adaptive capacity, reflects how climate change is perceived and acted upon. We argue that the narrative reflects a discourse within which fishers perceive changing weather and the need for climate adaptation. By looking at this narrative as an analytical object we are able to identify how underlying meaning and worldview among fishers structure and constitute aspects of latent adaptive capacity."
"227",95440503,244897,TRUE,FALSE,"Community resilience mechanism in an unexpected extreme weather event: An analysis of the Kerala floods of 2018, India","Community actions have a significant role in disaster response. This study analyses the socio-demographic and satisfaction variables within community resilience in the context of the Kerala floods of 2018 and elucidates its gaps from the perspective of a developing country. The data from the self-administered questionnaire survey among the fishermen who were prominent amongst the first responders during this flood were analyzed using SPSS. Global literature was also reviewed to examine the status of community resilience and its effectiveness in holistic disaster management. This is an issue which has rarely been addressed in past studies from India. The results indicate that the majority of the first responder-fishermen had a primary educational background. They have participated in the rescue mission as groups without much previous experience, but felt high levels of self-satisfaction afterwards. These first responders were well aware of coastal disasters, but had limited exposure to disaster preparedness and mock drills. Although hampered by limited physical and financial resources, they could effectively utilize their social capacities during the disaster. The importance of bottom up approach in disaster management, comprising `Community-Based Disaster Risk Management' (CBDRM) which can transform vulnerable communities to resilient communities is underlined in this study. The importance of the resilience of the local population, especially the fishermen community in local disaster response is highlighted, and the shortcomings in the current practices are identified. An attempt is also made to recognize and promote further potential through training, awareness and proper early warning."
"231",95440507,10264,TRUE,FALSE,"Cross-scale Adaptation Challenges in the Coastal Fisheries: Findings from Lebesby, Northern Norway","Cross-scale adaptation challenges in the coastal fisheries in Lebesby municipality, Finnmark County, northern Norway are examined on the basis of fieldwork conducted there. Although fishery actors in Lebesby are aware of, experience, and describe a number of connections between climate variability and coastal fishing activities, they do not characterize their livelihoods as being particularly vulnerable to climate change. Nevertheless, they identify a range of social factors that shape the flexibility of coastal fishing activities and livelihoods to deal with changing environmental conditions. We argue that these factors, and actors' perceptions of their own resilience, constitute important aspects of adaptive capacity and may challenge local responses to climate variability and change. We identified four adaptation arenas: local perceptions of vulnerability and resilience to climate change, Lebesby's social and economic viability, national fishery management and regulations, and the markets and economy of coastal fishing. The adaptation arenas arise and interact across geographic and temporal scales, creating specific barriers and opportunities for local adaptation. Our findings suggest the need to pay close attention to the cross-scale adaptation challenges facing Arctic communities that depend on natural resources. The concept of adaptation arenas helps to illustrate these challenges and should be applied more widely."
"246",95440521,7500,TRUE,FALSE,"Implementation challenges of climate change adaptation initiatives in coastal lagoon communities in the Gulf of Mexico","This paper explores some key challenges the Mexican government may face when implementing climate change adaptation initiatives in coastal lagoon communities in the Mexican state of Tabasco, in the Gulf of Mexico. I discuss some challenges state initiatives of this type may encounter considering the existence of local contentious political issues among various actors -fishers and the state-owned oil industry -that are at the core of the emergence of coastal environmental changes in the study site. A close analysis of local political, economic and environmental processes in coastal lagoon communities illustrates the existence of contentious issues among powerful actors over territory and its resources. It is in the context of these local, on the ground, issues that I argue that climate change adaptation interventions become highly political. I also argue that climate change policy analysis must be done in light of past and failed state interventions in Tabasco that have had a negative impact on ecosystems and fishers' livelihoods. My analysis of climate change adaptation initiatives and fishers' views on their local environmental problems is based on political ecology approaches to environmental narratives and critical literature on climate change."
"251",95440526,7668,TRUE,FALSE,"Protective factors for mental health and well-being in a changing climate: Perspectives from Inuit youth in Nunatsiavut, Labrador","The Canadian Arctic is experiencing rapid changes in climatic conditions, with implications for Inuit communities widely documented. Youth have been identified as an at-risk population, with likely impacts on mental health and well-being. This study identifies and characterizes youth-specific protective factors that enhance well-being in light of a rapidly changing climate, and examines how climatic and environmental change challenges these. In-depth conversational interviews were conducted with youth aged 15-25 from the five communities of the Nunatsiavut region of Labrador, Canada: Nain, Hopedale, Postville, Makkovik, and Rigolet. Five key protective factors were identified as enhancing their mental health and well-being: being on the land; connecting to Inuit culture; strong communities; relationships with family and friends; and staying busy. Changing sea ice and weather conditions were widely reported to be compromising these protective factors by reducing access to the land, and increasing the danger of land-based activities. This study contributes to existing work on Northern climate change adaptation by identifying factors that enhance youth resilience and, if incorporated into adaptation strategies, may contribute to creating successful and effective adaptation responses. (C) 2015 Elsevier Ltd. All rights reserved."
